{
  "attestation_id": "probe-attestation-v10-1-0001",
  "attestation_kind": "AZPR_V10_1_PROBE_SERVICE_ATTESTATION",
  "attestor_id": "probe-attestor-v10-1-0001",
  "attestor_key_id": "attestor-key-v10-1-0001",
  "attestor_role": "probe-service-attestor",
  "candidate_archive_sha256": "aaaaaaaaaaaaaaaaaaaaaaaaaaaaaaaaaaaaaaaaaaaaaaaaaaaaaaaaaaaaaaaa",
  "challenge_sha256": "bbbbbbbbbbbbbbbbbbbbbbbbbbbbbbbbbbbbbbbbbbbbbbbbbbbbbbbbbbbbbbbb",
  "expires_at": "2026-08-09T00:53:32.443297+00:00",
  "format_version": "1.1",
  "host_id": "host-v10-1-test-0001",
  "issued_at": "2026-08-07T00:51:32.443297+00:00",
  "launcher_identity_sha256": "cccccccccccccccccccccccccccccccccccccccccccccccccccccccccccccccc",
  "runtime_configuration_sha256": "dddddddddddddddddddddddddddddddddddddddddddddddddddddddddddddddd",
  "service_executable_sha256": "306c6ca7407560340797866e077e053627ad409277d1b9da58106fce4cf717cb",
  "service_id": "probe-service-v10-1-0001",
  "service_identity_sha256": "4b00f2125d58f084b2f99040caceb7560ab330b3f9f47a6e149195518c326a5f",
  "signature": "MwWHdJ95rD1hSYDINAEvSosXf1IJW+ciPS7g07jPxRGKQwW52XLVFXwUVa84F4jdJ7hV/6qmD4NCZ1s2SLVTDQ=="
}
